{
  "approval_source": "https://github.com/mikejmckinney/ai-repo-template/issues/545",
  "approved_at": "2026-08-05T08:48:00Z",
  "arm_c_authorization": {
    "approved_at": "2026-08-05T14:18:03Z",
    "prompt_path": "prompts/arm-c-prompt-gated.md",
    "prompt_sha256": "5710fc8d571955c5e1187d183821b376c7471debf9682fb7979d90e8821aa10e",
    "replacement_authorized": false,
    "treatment": "prompt-gated-autonomous"
  },
  "attempts": [
    {
      "attempt_id": "vs-p0b-next-a-attempt-1",
      "attempt_number": 1,
      "candidate_report_path": "results/phase-0b-revision/candidate-reports/vs-p0b-next-a-attempt-1.json",
      "evaluator_result_path": "results/phase-0b-revision/evaluations/vs-p0b-next-a-attempt-1.json",
      "finished_at": "2026-08-05T10:20:18Z",
      "is_replacement": false,
      "process_metadata_path": "results/phase-0b-revision/process/vs-p0b-next-a-attempt-1.json",
      "produced_work": true,
      "replacement_disposition": "not-eligible",
      "replacement_eligible": false,
      "result_path": "results/phase-0b-revision/attempts/vs-p0b-next-a-attempt-1.json",
      "run_id": "vs-p0b-next-a",
      "started_at": "2026-08-05T09:54:45Z",
      "terminal_status": "completed",
      "wall_clock_seconds": 1532
    },
    {
      "attempt_id": "vs-p0b-next-b-attempt-1",
      "attempt_number": 1,
      "candidate_report_path": "results/phase-0b-revision/candidate-reports/vs-p0b-next-b-attempt-1.json",
      "evaluator_result_path": "results/phase-0b-revision/evaluations/vs-p0b-next-b-attempt-1.json",
      "finished_at": "2026-08-05T10:57:51Z",
      "is_replacement": false,
      "process_metadata_path": "results/phase-0b-revision/process/vs-p0b-next-b-attempt-1.json",
      "produced_work": true,
      "replacement_disposition": "not-eligible",
      "replacement_eligible": false,
      "result_path": "results/phase-0b-revision/attempts/vs-p0b-next-b-attempt-1.json",
      "run_id": "vs-p0b-next-b",
      "started_at": "2026-08-05T10:28:23Z",
      "terminal_status": "completed",
      "wall_clock_seconds": 1767
    },
    {
      "attempt_id": "vs-p0b-next-c-attempt-1",
      "attempt_number": 1,
      "candidate_report_path": null,
      "evaluator_result_path": "results/phase-0b-revision/evaluations/vs-p0b-next-c-attempt-1.json",
      "finished_at": "2026-08-05T15:18:05Z",
      "is_replacement": false,
      "process_metadata_path": "results/phase-0b-revision/process/vs-p0b-next-c-attempt-1.json",
      "produced_work": true,
      "replacement_disposition": "not-eligible",
      "replacement_eligible": false,
      "result_path": "results/phase-0b-revision/attempts/vs-p0b-next-c-attempt-1.json",
      "run_id": "vs-p0b-next-c",
      "started_at": "2026-08-05T14:47:07Z",
      "terminal_status": "candidate-failed",
      "wall_clock_seconds": 1857
    }
  ],
  "campaign_id": "vector-siege-phase-0b-revision",
  "candidate_base": {
    "branch": "benchmark/model-roi/base-vector-siege-phase-0b-20260804",
    "sha": "acffeb51f6ba6d16be6872413a0fa9010d2547a2",
    "source_commit": "cf8e1545d688f6880baf21da24bf40a44bd4fc8c",
    "task_blob_sha": "f658eedd0c369d5b0323a098702eb6fd96bc418f"
  },
  "candidate_processes_started": 3,
  "completed_runs": [
    "vs-p0b-next-a",
    "vs-p0b-next-b",
    "vs-p0b-next-c"
  ],
  "implementation_sha": "6f961e2a291198798c6fa54d9f69573a121a684a",
  "official_pilot_scores_modified": false,
  "replacement_processes_started": 0,
  "schema_version": "task-parallelism-phase-0b-revision-execution.v1",
  "status": "completed"
}
